[
  {
    "id": "architecture-walkthrough",
    "title": "Architecture Walkthrough",
    "description": "How graph-browser works — from JSON data to interactive visualization.",
    "file": "data/tutorials/architecture-walkthrough.json"
  },
  {
    "id": "data-pipeline",
    "title": "The Data Pipeline",
    "description": "Follow the data from JSON files through decoding, indexing, filtering, and rendering.",
    "file": "data/tutorials/data-pipeline.json"
  }
]
